Текст анекдота,Опубликован?,Дата публикации
"Фармацевт в аптеке советует девушке антидепрессанты:<br>- Вот эти таблетки не берите, они не убирают агрессию, а просто улучшают настроение.<br>То есть если вы, например, убиваете людей топором, то после таблеток вы будете это делать с улыбкой.",,
"МИД РФ заявил, что США купили Аляску у Ларисы Долиной",,
"Когда лётчик обращается к пассажирам по громкой связи, понимаешь, что почерк врачей — это не самая неразборчивая вещь на свете.",,
"Почему в трансформерах нет женщин-роботов?<br>Они долго собираются.",,
"Новый помощник спрашивает старого аптекаря:<br>- А что это за лекарство вы держите отдельно, в ящичке рядом с кассой?<br>- Я даю его в тех случаях, когда мне не удаётся разобрать рецепт.",,
"'Армянское радио' спросили:<br>- Как определить является гей активным или пассивным?<br>'Армянское радио' ответило:<br>- Надо гея хорошенько разозлить.<br>Если при этом он скажет 'иди в жопу', то он - пассивный, а если 'иди на хер', то - активный.",,
"- Что ты мне подаришь на 14 февраля?<br>- Ничего.<br>- Ну скажи, хотя бы, что я красивая.<br>- Это на 1 апреля.",,
"В автобусе один из пассажиров упорно ковыряется в носу.<br>Все долго смотрели на него, наконец один не выдержал:<br>- Слушай, а может вообще не туда положил?",,
"И говорит Баба-Яга добру молодцу:<br>- Помогу я тебе, Ваня, но сначала спой мне песню не про милую и не про немилую, не про любовь и не про вражду, не грустную и не весёлую, не медленную и не быструю, не длинную и не короткую...<br>- Э, бабушка, - перебил её добрый молодец.<br>- Да тебе не песня нужна, а какое-то говно!<br>Сказал так и начал читать русский рэп.",,
"Вопрос к армянскому радио:<br>- Зачем Макрон так часто звонит Путину?<br>- Советуется, как выиграть на выборах не участвуя в дебатах.",,
"Можешь поздравить, я все-таки продал свою квартиру!<br>- Молодец! И когда собираешься заявлять, что сделал это под давлением?",,
"Армянское радио спрашивают: что такое 'облом'?<br>Армянское радио отвечает: 'Заезжаешь за девушкой на первое свидание. Шикарный букет, приличный шмот, зарезервирован столик ... она открывает... вообще отпад!!!<br>И тут из недр квартиры: 'мама, я покакал...'",,
"Роман Абрамович нашел заначку в старой куртке и поднялся на четыре пункта в списке «Форбс».",,
"- Фима, вот что это твоя Софочка всё время покупает в аптеке какой-то крэм - это таки от лица или от чего?<br>- Ой, Жора! Не мучай мне голову!<br>Это противозачаточный крэм: она как им намажется - таки лучше к ней и не подходить...",,
"- Софочка, зачем ты накупила столько презервативов? У тебя таки давно нет мужчины.<br>- Ах, Бэлла Марковна! В очереди в аптеке за мной стояла соседка.<br>Ради её отвисшей челюсти я никаких денег не пожалела.",,
"'Армянское радио' спрашивают: 'Что надо сделать, чтобы футбольный клуб Арарат выиграл у футбольного клуба Барселона?'<br>'Армянское радио' отвечает: 'Надо поменяться футболками не после, а до игры.'",,
"На улице машина сбивает прохожего.<br>Из машины выскакивает девушка, подбегает к сбитому человеку и говорит:<br>- Вы не представляете, как вам повезло.<br>- Это почему же?<br>- Я сбила вас прямо напротив кабинета врача!<br>- Ничего себе - повезло...<br>Врач - это я.",,
"- Софочка, расскажите, как вы познакомились со своим Фимой?<br>- Та... Я тогда работала в аптеке, а он пришёл за презервативами и попросил размер XXXL...<br>И таки после свадьбы я узнала, шо этот поц заикается...",,
"Сегодня, проехав в маршрутке, поняла, что дезодоранты, подаренные мужикам на 23 февраля, закончились.",,
"А зачем эти петельки на верхних поручнях автобуса, у меня туда голова не пролазит.",,
"Моя девушка считает, что новая продукция Эппл - прекрасный подарок к Новому году.<br>Спасибо, Эппл, что сняла эту головную боль, мне не надо больше думать над тем, что ей подарить.<br>Мы расстаемся.",,
"Мальчики, уступайте девочкам место в автобусе!<br>Сверху лучше сиськи видно.",,
"Мужик в аптеке:<br>- Мне нужно что-нибудь от горла.<br>- Вам пососать? - уточняет аптекарша.<br>- Ну, пососите, если это поможет...",,
"Девушка, отказавшая молодому Роману Абрамовичу, с тех пор на всякий случай не отказывает никому.",,
"В давние-давние времена Господь слепил десять Адамов.<br>Один из них пахал землю, другой пас овец, третий — ловил рыбу...<br>Спустя некоторое время пришли они к Отцу своему с просьбой:<br>— Все есть, но чего-то не хватает. Скучно нам.<br>Господь дал им тесто и сказал:<br>— Пусть каждый слепит по своему подобию женщину, кому какая нравится: полная, худая, высокая, маленькая...<br>А я вдохну в них жизнь.<br>После этого Господь вынес на блюде сахар и сказал:<br>— Здесь десять кусочков.<br>Пусть каждый возьмет по одному и даст жене, чтобы жизнь с ней была сладкой.<br>Все так и сделали.<br>А потом Господь сказал:<br>— Среди вас есть плут, ибо на блюде было одиннадцать кусков сахара.<br>Кто взял два куска?<br>Все молчали.<br>Господь забрал у них жён, перемешал их, а потом раздал, кому какая попалась.<br>С тех пор девять мужчин из десяти думают, что чужая жена слаще, потому что она съела лишний кусок сахара.<br>И только один из Адамов знает, что все женщины одинаковы, ибо лишний кусок сахара съел он сам.",,
"Прапорщик на занятиях:<br>- Если вам вдруг потребуется узнать длину какой-либо окружности, то можно воспользоваться, например, ремнём от автомата, расположив его по этой окружности и затем измерив.<br>Рядовой:<br>- Но ведь можно просто измерить диаметр и умножить на π.<br>- Товарищ рядовой, подумайте, что говорите.<br>Где вы в полевых условиях возьмёте π?!",,
"Разговаривают два приятеля:<br>- Слушай, тёща с женой меня уже замучили своими расспросами, что подарить на 23 февраля.<br>А мне ничего не надо, всё есть.<br>Что ты мне посоветуешь?<br>- Ну, попроси необычный секс, например...<br>- Необычный? Хм-м... Ладно...<br>Так, а у жены чего просить?",,
"– Можно ли гладить нейлоновые чулки?<br>Армянское радио:<br>– Можно, если они на хорошенькой ножке.",,
"У золотой рыбки начинается нервный срыв, как только она видит на берегу Абрамовича.",,
"Командир батальона описывает солдатам боевую ситуацию:<br>- Неприятель находится сзади от нас, слева, справа и впереди...<br>Что вы об этом думаете?<br>- Уж теперь он от нас не скроется!",,
"- Привет детка, отдыхаешь?<br>Почему такая красотка и совсем одна?<br>- Очень смешно, Адам.",,
"В одесской аптеке:<br>- Есть ли у вас что-нибудь для седых волос?<br>- Конечно! Таки глубокое уважение...",,
"Роман Абрамович забыл вытащить бумажник из кармана и случайно постирал годовой бюджет Нигерии.",,
"Сын уронил мой айфон и слегка повредил экран.<br>Если кого-то интересует - могу подарить: ему 3 года, русый, глаза карие.",,
"Сейчас авиакомпании дружно пишут, что надеются на наши понимание и поддержку в это трудное время.<br>Хочется спросить: 'А где вы были, когда мой чемодан весил 23,1 кг?'",,
"Дежурный по кухне спрашивает у повара после того, как снял пробу:<br>- Вы служили в армии во время войны?<br>- Так точно, Ваше благородие, - отвечает повар.<br>- Был поваром, дважды ранен в голову.<br>- Вам повезло.<br>Просто удивительно, как это вас не убили.",,
"Собирается солдат идти в увольнение, его напутствует сержант:<br>- Вот тебе тысяча рублей, выбери девку поздоровей, своди её в парк...<br>Возвращаясь, солдат докладывает:<br>- Всё в порядке, товарищ сержант, был с девкой в парке.<br>- А девка-то хоть была здоровая?<br>- Ох и здоровая, еле тысячу обратно отнял!",,
"- Миленький, иди ко мне, я соскучилась.<br>- Подожди, я только Apple Watch сниму.<br>- Зачем, мой пупсик, они же такие классные.<br>- У меня жена - врач.<br>Она по кардиограмме сразу поймёт, что ни в каком министерстве на совещании я не был.",,
"На 1 апреля Обаму достали шутками:<br>- Мужчина, у вас весь дом - Белый.",,
"- Дорогая, что бы ты хотела в подарок на День Святого Валентина?<br>- Сумку из змеиной кожи.<br>- Это очень дорого.<br>- Тогда разреши мне почитать твои сообщения 'ВКонтакте'...",,
"Может ли олигарх быть близким и преданным другом?<br>Даже не знаю, что сказать…<br>Вот анализирую круг своих знакомых — и ни одного такого найти не могу.",,
"'Армянское радио' спрашивают:<br>- Что делать, если не хватает денег на капризы молодой любовницы?<br>'Армянское радио' отвечает:<br>- Найдите ей мужа.",,
"Мужик в аптеке:<br>- Дайте три с половиной таблетки виагры!<br>Аптекарь:<br>- А почему три с половиной???<br>- Я сегодня к любовнице, нужны две.<br>Завтра с женой, там хватит и одной.<br>А в четверг я иду в Сандуны, там я должен просто хорошо выглядеть.",,
"Адам скучал.<br>Какой рай без женщины?<br>И дал Бог ему женщину.<br>И кончился рай.",,
"1 апреля из кабинета товарища Сталина выходило много седых, но радостных людей.",,
"Вопрос армянскому радио:<br>- Правы ли те, кто утверждает, что в споре побеждает тот, кто не слышит аргументов оппонента?<br>- Категорически нет!<br>Обычно в споре побеждает тот, кто не знает такого слова - аргументы!",,
"Абрамович ругает сына:<br>- Ты почему кол получил за сочинение?<br>Какая тема была?<br>- 'Представь, что твой папа - миллионер!'<br>- Охуели что ли? - не сдержался олигарх.<br>- Я так и написал...",,
"Бензоколонка, близится полночь.<br>Подъезжает автомобиль, водитель спрашивает заправщика:<br>- Почём сегодня бензин?<br>- Три семьдесят, сэр.<br>Но вы последний, кто может заправиться по этой цене.<br>Мы меняем цены в полночь.<br>Довольный водила просит заправить полный бак и, расплачиваясь, между делом интересуется:<br>- А завтра какая цена будет?<br>- На двадцать центов дешевле, сэр.",,
"Вопрос армянскому радио:<br>- Могут ли считаться культурными люди, которые не читали Толстого и Достоевского?<br>Ответ:<br>- Да, если это те люди, которых читали Толстой и Достоевский.",,
"Продавщица, упаковывая в нарядную фольгу приобретённую солидным мужчиной гору бюстгальтеров и женских трусиков:<br>- Какой чудесный подарок на День влюблённых!<br>А комбинашки покупать не будете?<br>Мужчина, злобно:<br>- Комбинашки пускай им мужья покупают!",,
"Адам с Евой резвятся в саду, спускается к ним Бог и говорит:<br>- Дети мои, у меня есть вам два подарка, только вы должны решить кому какой..<br>Первый подарок - писать стоя..<br>Ну Адам громче всех орал и бился головой об деревья, что он хочет писать стоя, что всю жизнь мечтал.<br>Ева ему уступила..<br>И Адам побежал по саду, радовался, прыгал, кричал, ссал на все подряд!<br>На деревья, на цветы, на каждую букашку и просто на землю!<br>Ева встала рядом с Богом..<br>В молчании смотрели они вместе на это безумие..<br>И тут Ева спросила:<br>- Боже мой, а второй-то подарок какой?..<br>И молвил Бог:<br>- Мозги, Ева.. Мозги..!<br>Но мозги, Ева, придется тоже отдать Адаму, иначе он тут все обоссыт!",,
"Вопрос армянскому радио:<br>- Может ли мужчина умереть от засоса на шее?<br>Ответ:<br>- Может, если этот засос обнаружит его жена.",,
"- Змей пожалел, что соблазнил Адама и Еву.<br>- Почему?<br>- Когда Ева съела яблоко, то она увидела в Змее не только животное, но и ремень, кошелек и сумочку.",,
"Выходит хирург из кабинета.<br>- А пациент жив?<br>- Да, а что?<br>- Я ему сказать что-то хотела.<br>- Ну, давайте я передам.<br>- А я на права сдала?",,
"Жил-был Адам.<br>И был он один на всём белом свете.<br>И сказал ему Бог:<br>- Приведу-ка я тебе Еву...<br>Так родилась фраза: 'Не приведи, Господь!'",,
"- ты слышал, американские учёные изобрели противозачаточный пластырь для женщин!<br>- пффффф, будто обычным залепить нельзя!",,
"Как говорил мой ротный на марш-броске??:<br>'Что упало, то отжалось и побежало дальше'.",,
"Вопрос армянскому радио:<br>- Могут ли мужчина и женщина дружить без секса?<br>Ответ:<br>- Да.<br>Если они состоят в браке.",,
"Армянскому радио задали вопрос:<br>- Можно ли маленьким членом доставить женщине большое удовольствие?<br>- Канэшна!<br>Её можно сильно рассмешить.",,
"- Дорогой, я беременна.<br>- Что-о-о-о-о?!<br>- С 1 апреля тебя, любимый!<br>- Люся, ты чё, ну так же до инфаркта довести можно.<br>- Как ты меня назвал?!<br>Какая я тебе Люся?!<br>- С 1 апреля тебя, любимая!",,
"Приходит Тим Кук в бар, даёт бармену деньги и просит налить ему виски.<br>Бармен достаёт бутылку и выливает её содержимое на стойку, а потом говорит:<br>- Стакан нужно было покупать отдельно.",,
"Вопрос армянскому радио:<br>Правда ли, что смех — это лучшее лекарство?<br>Ответ:<br>Да, если у вас нет поноса!",,
"И пришел однажды Адам к Создателю.<br>И спросил его:<br>- Всемогущий, что за змея живет в моем доме, тырит яблоки из райского сада и относит их Еве?<br>- Пусть пока поживет с вами.<br>Да... и называй ее тещей.<br>Твоему роду это пригодится.",,
"- Пожалуйста, дайте витамин для ребёнка.<br>- Вам 'А', 'В', 'С' или 'D'? - спросил аптекарь.<br>- Всё равно, он пока не умеет читать.",,
"Если мужчина говорит, что ты уродина, он, скорее всего, хочет причинить тебе боль.<br>Если женщина говорит, что ты уродина, она, скорее всего, тебе завидует.<br>Если ребенок говорит, что ты уродина, ты, скорее всего, уродина.",,
"У меня начальник всегда под мухой.<br>- Что - всегда пьяный?!!<br>- Нет, всегда говно...",,
